{
  "$schema": "https://json-schema.org/draft/2020-12/schema",
  "$id": "projeto.schema.json",
  "title": "Caminhos do projeto",
  "type": "object",
  "required": ["versao_schema", "prefixo_planilhas", "resolucao_imagens", "nome_licenca_conteudo",
               "colunas_ocultas", "coluna_subdecks", "caminhos"],
  "additionalProperties": true,
  "properties": {
    "versao_schema": { "const": 1 },
    "prefixo_planilhas": { "$ref": "#/$defs/texto" },
    "resolucao_imagens": { "type": "integer" },
    "nome_licenca_conteudo": { "$ref": "#/$defs/texto" },
    "colunas_ocultas": {
      "type": "array",
      "items": { "type": "string", "minLength": 1, "not": { "enum": ["pergunta", "resposta", "fonte"] } }
    },
    "coluna_subdecks": {
      "anyOf": [
        { "type": "null" },
        { "type": "string", "minLength": 1, "not": { "enum": ["pergunta", "resposta", "fonte"] } }
      ]
    },
    "caminhos": {
      "type": "object",
      "additionalProperties": true,
      "required": ["formato", "fontes", "referencias", "licenca_conteudo", "material_base", "fontes_externas",
                   "gerados", "conferencia_imagens", "conferencia_referencias", "material_gerado", "baralhos",
                   "bases", "base_externa", "conferencia_trechos", "provas", "conferencia_cartoes", "imagens",
                   "estilo_cartao"],
      "properties": {
        "formato": { "$ref": "#/$defs/texto" },
        "fontes": { "$ref": "#/$defs/texto" },
        "referencias": { "$ref": "#/$defs/texto" },
        "licenca_conteudo": { "$ref": "#/$defs/texto" },
        "material_base": { "$ref": "#/$defs/pasta_protegida" },
        "fontes_externas": { "$ref": "#/$defs/protegido" },
        "gerados": { "$ref": "#/$defs/protegido" },
        "conferencia_imagens": { "$ref": "#/$defs/protegido" },
        "conferencia_referencias": { "$ref": "#/$defs/protegido" },
        "material_gerado": { "$ref": "#/$defs/texto" },
        "baralhos": { "$ref": "#/$defs/texto" },
        "bases": { "$ref": "#/$defs/modelo_por_item" },
        "base_externa": { "allOf": [ { "$ref": "#/$defs/protegido" }, { "$ref": "#/$defs/modelo_por_item" } ] },
        "conferencia_trechos": { "$ref": "#/$defs/protegido" },
        "provas": { "allOf": [ { "$ref": "#/$defs/protegido" }, { "type": "string", "pattern": "\\{planilha\\}" } ] },
        "conferencia_cartoes": { "$ref": "#/$defs/protegido" },
        "imagens": { "$ref": "#/$defs/protegido" },
        "estilo_cartao": { "$ref": "#/$defs/texto" }
      }
    }
  },
  "$defs": {
    "texto": { "type": "string", "minLength": 1 },
    "modelo_por_item": { "type": "string", "pattern": "\\{item\\}" },
    "pasta_protegida": {
      "description": "a pasta do material de terceiros: nunca muda de nome nem de lugar",
      "const": "docs/material-base"
    },
    "protegido": {
      "description": "tudo o que tem texto de terceiros fica dentro da pasta protegida",
      "type": "string",
      "pattern": "^docs/material-base/"
    }
  }
}
